{
  "Browser": "Microsoft Edge/125.0.2535.67",
  "Protocol-Version": "1.3",
  "User-Agent": "Mozilla/5.0 (Windows NT 10.0; Win64; x64) AppleWebKit/537.36 (KHTML, like Gecko) Chrome/125.0.0.0 Safari/537.36 Edg/125.0.2535.67",
  "V8-Version": "12.5.283.0",
  "WebKit-Version": "537.36 (@5e1dbf36c5a5c0e54e54eab9)",
  "webSocketDebuggerUrl": "ws://localhost:9222/devtools/browser/a1b2c3d4-e5f6-7890-abcd-ef1234567890"
}
